{
    "Ransomware News (VX)": [
        {
            "Message ID": 3088,
            "Group": "ransomhub",
            "Approx. Time": "20:41 07/10/24",
            "Title": "https://t.co/h9LRXf5Zci",
            "Date": "2024-10-07"
        },
        {
            "Message ID": 3087,
            "Group": "monti",
            "Approx. Time": "18:48 07/10/24",
            "Title": "Richmond Auto Mall - Full Leak",
            "Date": "2024-10-07"
        },
        {
            "Message ID": 3086,
            "Group": "bianlian",
            "Approx. Time": "18:47 07/10/24",
            "Title": "Pearl Cohen",
            "Date": "2024-10-07"
        },
        {
            "Message ID": 3085,
            "Group": "ransomhub",
            "Approx. Time": "14:43 07/10/24",
            "Title": "https://t.co/ONq4xfmh16",
            "Date": "2024-10-07"
        },
        {
            "Message ID": 3084,
            "Group": "ransomhub",
            "Approx. Time": "14:43 07/10/24",
            "Title": "https://t.co/SBWB7lUgGP",
            "Date": "2024-10-07"
        },
        {
            "Message ID": 3083,
            "Group": "everest",
            "Approx. Time": "00:47 07/10/24",
            "Title": "Broward Realty Corp",
            "Date": "2024-10-07"
        },
        {
            "Message ID": 3082,
            "Group": "lockbit3",
            "Approx. Time": "22:42 06/10/24",
            "Title": "https://t.co/7leHgDEQpj",
            "Date": "2024-10-06"
        },
        {
            "Message ID": 3081,
            "Group": "lockbit3",
            "Approx. Time": "22:42 06/10/24",
            "Title": "https://t.co/QdqaUtCabI",
            "Date": "2024-10-06"
        },
        {
            "Message ID": 3080,
            "Group": "lockbit3",
            "Approx. Time": "22:42 06/10/24",
            "Title": "https://t.co/7JrOsoAF2S",
            "Date": "2024-10-06"
        },
        {
            "Message ID": 3079,
            "Group": "lockbit3",
            "Approx. Time": "22:42 06/10/24",
            "Title": "https://t.co/eJMuHK3xax",
            "Date": "2024-10-06"
        },
        {
            "Message ID": 3078,
            "Group": "lockbit3",
            "Approx. Time": "22:42 06/10/24",
            "Title": "https://t.co/3Ig8tW5Wbi",
            "Date": "2024-10-06"
        },
        {
            "Message ID": 3077,
            "Group": "lockbit3",
            "Approx. Time": "22:42 06/10/24",
            "Title": "https://t.co/l3FnoZjSpT",
            "Date": "2024-10-06"
        },
        {
            "Message ID": 3076,
            "Group": "lockbit3",
            "Approx. Time": "22:42 06/10/24",
            "Title": "https://t.co/wkk2LSxzgy",
            "Date": "2024-10-06"
        },
        {
            "Message ID": 3075,
            "Group": "lockbit3",
            "Approx. Time": "22:42 06/10/24",
            "Title": "https://t.co/ilbDqQy5rT",
            "Date": "2024-10-06"
        },
        {
            "Message ID": 3074,
            "Group": "lockbit3",
            "Approx. Time": "22:42 06/10/24",
            "Title": "https://t.co/NhO07ME9Ib",
            "Date": "2024-10-06"
        },
        {
            "Message ID": 3073,
            "Group": "lockbit3",
            "Approx. Time": "22:42 06/10/24",
            "Title": "https://t.co/e3Ol6j3FGR",
            "Date": "2024-10-06"
        },
        {
            "Message ID": 3072,
            "Group": "lockbit3",
            "Approx. Time": "22:42 06/10/24",
            "Title": "https://t.co/Obu3Sak5m3",
            "Date": "2024-10-06"
        },
        {
            "Message ID": 3071,
            "Group": "lockbit3",
            "Approx. Time": "22:42 06/10/24",
            "Title": "https://t.co/Y7Jmk1C82v",
            "Date": "2024-10-06"
        },
        {
            "Message ID": 3070,
            "Group": "lockbit3",
            "Approx. Time": "22:42 06/10/24",
            "Title": "https://t.co/dxd8WLNcef",
            "Date": "2024-10-06"
        },
        {
            "Message ID": 3069,
            "Group": "lockbit3",
            "Approx. Time": "22:42 06/10/24",
            "Title": "https://t.co/GMU7oVKbYk",
            "Date": "2024-10-06"
        },
        {
            "Message ID": 3068,
            "Group": "lockbit3",
            "Approx. Time": "22:42 06/10/24",
            "Title": "https://t.co/2h22Rcaoi8",
            "Date": "2024-10-06"
        },
        {
            "Message ID": 3067,
            "Group": "handala",
            "Approx. Time": "16:38 06/10/24",
            "Title": "IIB ( Israeli Industrial Batteries ) Leaked",
            "Date": "2024-10-06"
        },
        {
            "Message ID": 3066,
            "Group": "killsecurity",
            "Approx. Time": "00:43 06/10/24",
            "Title": "https://t.co/8L7JVWbk2S",
            "Date": "2024-10-06"
        },
        {
            "Message ID": 3065,
            "Group": "stormous",
            "Approx. Time": "00:42 06/10/24",
            "Title": "https://t.co/WUkvlEwC0z",
            "Date": "2024-10-06"
        },
        {
            "Message ID": 3064,
            "Group": "stormous",
            "Approx. Time": "00:42 06/10/24",
            "Title": "https://t.co/wbT3E4rxNc",
            "Date": "2024-10-06"
        },
        {
            "Message ID": 3063,
            "Group": "play",
            "Approx. Time": "22:33 05/10/24",
            "Title": "Power Torque Services",
            "Date": "2024-10-05"
        },
        {
            "Message ID": 3062,
            "Group": "play",
            "Approx. Time": "22:33 05/10/24",
            "Title": "Creative Consumer Concepts",
            "Date": "2024-10-05"
        },
        {
            "Message ID": 3061,
            "Group": "ransomhub",
            "Approx. Time": "20:41 05/10/24",
            "Title": "https://t.co/u3dfl3jIob",
            "Date": "2024-10-05"
        },
        {
            "Message ID": 3060,
            "Group": "ransomhub",
            "Approx. Time": "20:41 05/10/24",
            "Title": "https://t.co/sExpDlWQ57",
            "Date": "2024-10-05"
        },
        {
            "Message ID": 3059,
            "Group": "hunters",
            "Approx. Time": "16:45 05/10/24",
            "Title": "Ibermutuamur",
            "Date": "2024-10-05"
        },
        {
            "Message ID": 3058,
            "Group": "killsecurity",
            "Approx. Time": "10:38 05/10/24",
            "Title": "https://t.co/TFVabqcUar",
            "Date": "2024-10-05"
        },
        {
            "Message ID": 3057,
            "Group": "ransomhub",
            "Approx. Time": "10:38 05/10/24",
            "Title": "https://t.co/7MFqhihT8f",
            "Date": "2024-10-05"
        },
        {
            "Message ID": 3056,
            "Group": "hunters",
            "Approx. Time": "08:35 05/10/24",
            "Title": "BNBuilders",
            "Date": "2024-10-05"
        },
        {
            "Message ID": 3055,
            "Group": "ransomhub",
            "Approx. Time": "04:39 05/10/24",
            "Title": "https://t.co/61MSNDfIhZ",
            "Date": "2024-10-05"
        },
        {
            "Message ID": 3054,
            "Group": "play",
            "Approx. Time": "22:32 04/10/24",
            "Title": "Wilmington Convention Center",
            "Date": "2024-10-04"
        },
        {
            "Message ID": 3053,
            "Group": "play",
            "Approx. Time": "22:32 04/10/24",
            "Title": "Pete's Road Service",
            "Date": "2024-10-04"
        },
        {
            "Message ID": 3052,
            "Group": "play",
            "Approx. Time": "22:32 04/10/24",
            "Title": "Markdom Plastic Products",
            "Date": "2024-10-04"
        },
        {
            "Message ID": 3051,
            "Group": "play",
            "Approx. Time": "22:32 04/10/24",
            "Title": "Guerriere & Halnon",
            "Date": "2024-10-04"
        },
        {
            "Message ID": 3050,
            "Group": "play",
            "Approx. Time": "22:32 04/10/24",
            "Title": "C&L Ward",
            "Date": "2024-10-04"
        },
        {
            "Message ID": 3049,
            "Group": "ransomhub",
            "Approx. Time": "18:35 04/10/24",
            "Title": "https://t.co/91r4GVZiej",
            "Date": "2024-10-04"
        },
        {
            "Message ID": 3048,
            "Group": "ransomhub",
            "Approx. Time": "18:35 04/10/24",
            "Title": "https://t.co/tdBOob9N1V",
            "Date": "2024-10-04"
        },
        {
            "Message ID": 3047,
            "Group": "blacksuit",
            "Approx. Time": "18:35 04/10/24",
            "Title": "https://t.co/Grbw4EKCqo",
            "Date": "2024-10-04"
        },
        {
            "Message ID": 3046,
            "Group": "monti",
            "Approx. Time": "18:35 04/10/24",
            "Title": "City Of Forest Park - Full Leak",
            "Date": "2024-10-04"
        },
        {
            "Message ID": 3045,
            "Group": "akira",
            "Approx. Time": "16:35 04/10/24",
            "Title": "Riley Gear Corporati on",
            "Date": "2024-10-04"
        },
        {
            "Message ID": 3044,
            "Group": "akira",
            "Approx. Time": "16:35 04/10/24",
            "Title": "TANYA Creations",
            "Date": "2024-10-04"
        },
        {
            "Message ID": 3043,
            "Group": "ciphbit",
            "Approx. Time": "14:39 04/10/24",
            "Title": "https://t.co/s2v7YQaeAs",
            "Date": "2024-10-04"
        },
        {
            "Message ID": 3042,
            "Group": "akira",
            "Approx. Time": "14:39 04/10/24",
            "Title": "North American Break er",
            "Date": "2024-10-04"
        },
        {
            "Message ID": 3041,
            "Group": "hunters",
            "Approx. Time": "12:37 04/10/24",
            "Title": "GW Mechanical",
            "Date": "2024-10-04"
        },
        {
            "Message ID": 3040,
            "Group": "hunters",
            "Approx. Time": "12:37 04/10/24",
            "Title": "Dreyfuss + Blackford Architecture",
            "Date": "2024-10-04"
        },
        {
            "Message ID": 3039,
            "Group": "hunters",
            "Approx. Time": "12:37 04/10/24",
            "Title": "Amplitude Laser",
            "Date": "2024-10-04"
        },
        {
            "Message ID": 3038,
            "Group": "ransomhouse",
            "Approx. Time": "12:37 04/10/24",
            "Title": "Fursan Travel",
            "Date": "2024-10-04"
        },
        {
            "Message ID": 3037,
            "Group": "ransomhub",
            "Approx. Time": "10:37 04/10/24",
            "Title": "https://t.co/o0glXkMZ0e",
            "Date": "2024-10-04"
        },
        {
            "Message ID": 3036,
            "Group": "qilin",
            "Approx. Time": "10:37 04/10/24",
            "Title": "McGaughey &amp; Keaney CPAs",
            "Date": "2024-10-04"
        },
        {
            "Message ID": 3035,
            "Group": "qilin",
            "Approx. Time": "08:36 04/10/24",
            "Title": "DPC DATA",
            "Date": "2024-10-04"
        },
        {
            "Message ID": 3034,
            "Group": "cicada3301",
            "Approx. Time": "02:59 04/10/24",
            "Title": "https://t.co/PHR6ZkltdR",
            "Date": "2024-10-04"
        },
        {
            "Message ID": 3033,
            "Group": "killsecurity",
            "Approx. Time": "00:47 04/10/24",
            "Title": "https://t.co/emGyA4mLSy",
            "Date": "2024-10-04"
        },
        {
            "Message ID": 3032,
            "Group": "hunters",
            "Approx. Time": "22:38 03/10/24",
            "Title": "CobelPlast",
            "Date": "2024-10-03"
        },
        {
            "Message ID": 3031,
            "Group": "handala",
            "Approx. Time": "20:40 03/10/24",
            "Title": "Shin Bet Hacked",
            "Date": "2024-10-03"
        },
        {
            "Message ID": 3030,
            "Group": "trinity",
            "Approx. Time": "18:33 03/10/24",
            "Title": "https://t.co/X1sJChm4I0",
            "Date": "2024-10-03"
        },
        {
            "Message ID": 3029,
            "Group": "trinity",
            "Approx. Time": "18:33 03/10/24",
            "Title": "Barnes &amp; Cohen",
            "Date": "2024-10-03"
        },
        {
            "Message ID": 3028,
            "Group": "trinity",
            "Approx. Time": "18:33 03/10/24",
            "Title": "https://t.co/RRC7Y9ZMXh",
            "Date": "2024-10-03"
        },
        {
            "Message ID": 3027,
            "Group": "akira",
            "Approx. Time": "16:40 03/10/24",
            "Title": "TRC Worldwide Engine ering (Trcww)",
            "Date": "2024-10-03"
        },
        {
            "Message ID": 3026,
            "Group": "akira",
            "Approx. Time": "16:40 03/10/24",
            "Title": "Rob Levine & Associa tes (https://t.co/x21mPTaYB0)",
            "Date": "2024-10-03"
        },
        {
            "Message ID": 3025,
            "Group": "hunters",
            "Approx. Time": "12:39 03/10/24",
            "Title": "CaleyWray",
            "Date": "2024-10-03"
        },
        {
            "Message ID": 3024,
            "Group": "rhysida",
            "Approx. Time": "06:39 03/10/24",
            "Title": "Golden Age Nursing Home",
            "Date": "2024-10-03"
        },
        {
            "Message ID": 3023,
            "Group": "qilin",
            "Approx. Time": "00:43 03/10/24",
            "Title": "Forshey Prostok LLP",
            "Date": "2024-10-03"
        },
        {
            "Message ID": 3022,
            "Group": "blacksuit",
            "Approx. Time": "22:38 02/10/24",
            "Title": "https://t.co/taiNx8C0be",
            "Date": "2024-10-02"
        },
        {
            "Message ID": 3021,
            "Group": "ransomhub",
            "Approx. Time": "20:42 02/10/24",
            "Title": "https://t.co/E7LjZa1oSt",
            "Date": "2024-10-02"
        },
        {
            "Message ID": 3020,
            "Group": "ransomhub",
            "Approx. Time": "20:42 02/10/24",
            "Title": "https://t.co/RFA1mOwb4t",
            "Date": "2024-10-02"
        },
        {
            "Message ID": 3019,
            "Group": "ransomhub",
            "Approx. Time": "20:42 02/10/24",
            "Title": "https://t.co/tAh4OYxGF6",
            "Date": "2024-10-02"
        },
        {
            "Message ID": 3018,
            "Group": "ransomhub",
            "Approx. Time": "20:42 02/10/24",
            "Title": "https://t.co/02THs4GkjU",
            "Date": "2024-10-02"
        },
        {
            "Message ID": 3017,
            "Group": "ransomhub",
            "Approx. Time": "20:42 02/10/24",
            "Title": "https://t.co/4q7Kyabty1",
            "Date": "2024-10-02"
        },
        {
            "Message ID": 3016,
            "Group": "cactus",
            "Approx. Time": "20:42 02/10/24",
            "Title": "https://t.co/6EcY0OUqUW\\$149M\\USA\\240GB\\100% DISCLOSED",
            "Date": "2024-10-02"
        },
        {
            "Message ID": 3015,
            "Group": "cactus",
            "Approx. Time": "20:42 02/10/24",
            "Title": "https://t.co/uRj6DVhMI4\\$30.6M\\United Kingdom\\380GB\\100% DISCLOSED",
            "Date": "2024-10-02"
        },
        {
            "Message ID": 3014,
            "Group": "cactus",
            "Approx. Time": "20:41 02/10/24",
            "Title": "https://t.co/WcAB9XKRXi\\$18.8M\\United Kingdom\\1.2TB\\100% DISCLOSED",
            "Date": "2024-10-02"
        },
        {
            "Message ID": 3013,
            "Group": "cactus",
            "Approx. Time": "20:41 02/10/24",
            "Title": "https://t.co/1WeD6FDAZa\\$28.7M\\USA\\605GB\\100% DISCLOSED",
            "Date": "2024-10-02"
        },
        {
            "Message ID": 3012,
            "Group": "akira",
            "Approx. Time": "16:38 02/10/24",
            "Title": "ETC Companies",
            "Date": "2024-10-02"
        },
        {
            "Message ID": 3011,
            "Group": "akira",
            "Approx. Time": "16:38 02/10/24",
            "Title": "Holmes & Brakel",
            "Date": "2024-10-02"
        },
        {
            "Message ID": 3010,
            "Group": "handala",
            "Approx. Time": "10:44 02/10/24",
            "Title": "Israel Prime Minister Emails",
            "Date": "2024-10-02"
        },
        {
            "Message ID": 3009,
            "Group": "trinity",
            "Approx. Time": "06:38 02/10/24",
            "Title": "https://t.co/RRC7Y9ZMXh",
            "Date": "2024-10-02"
        },
        {
            "Message ID": 3008,
            "Group": "trinity",
            "Approx. Time": "06:38 02/10/24",
            "Title": "FoccoERP",
            "Date": "2024-10-02"
        },
        {
            "Message ID": 3007,
            "Group": "stormous",
            "Approx. Time": "02:59 02/10/24",
            "Title": "https://t.co/nmZRwkXD6n",
            "Date": "2024-10-02"
        },
        {
            "Message ID": 3006,
            "Group": "qilin",
            "Approx. Time": "20:37 01/10/24",
            "Title": "United Animal Health",
            "Date": "2024-10-01"
        },
        {
            "Message ID": 3005,
            "Group": "akira",
            "Approx. Time": "16:46 01/10/24",
            "Title": "Cascade Columbia Dis tribution",
            "Date": "2024-10-01"
        },
        {
            "Message ID": 3004,
            "Group": "akira",
            "Approx. Time": "16:46 01/10/24",
            "Title": "ShoreMaster",
            "Date": "2024-10-01"
        },
        {
            "Message ID": 3003,
            "Group": "akira",
            "Approx. Time": "16:46 01/10/24",
            "Title": "CSG Consultants",
            "Date": "2024-10-01"
        },
        {
            "Message ID": 3002,
            "Group": "akira",
            "Approx. Time": "14:39 01/10/24",
            "Title": "Enviromental Design  International",
            "Date": "2024-10-01"
        },
        {
            "Message ID": 3001,
            "Group": "stormous",
            "Approx. Time": "14:38 01/10/24",
            "Title": "https://t.co/zIBL7a3cX3",
            "Date": "2024-10-01"
        },
        {
            "Message ID": 3000,
            "Group": "qilin",
            "Approx. Time": "10:35 01/10/24",
            "Title": "Turman",
            "Date": "2024-10-01"
        },
        {
            "Message ID": 2999,
            "Group": "qilin",
            "Approx. Time": "10:35 01/10/24",
            "Title": "performance-therapies",
            "Date": "2024-10-01"
        },
        {
            "Message ID": 2998,
            "Group": "cactus",
            "Approx. Time": "08:43 01/10/24",
            "Title": "https://t.co/p0ezcIr6Iv\\$7.9M\\Germany\\120GB\\&lt;1% DISCLOSED",
            "Date": "2024-10-01"
        },
        {
            "Message ID": 2997,
            "Group": "killsecurity",
            "Approx. Time": "00:41 01/10/24",
            "Title": "https://t.co/dvz22RW1ji",
            "Date": "2024-10-01"
        },
        {
            "Message ID": 2996,
            "Group": "killsecurity",
            "Approx. Time": "00:41 01/10/24",
            "Title": "https://t.co/dJEC36eF0O",
            "Date": "2024-10-01"
        },
        {
            "Message ID": 2995,
            "Group": "blacksuit",
            "Approx. Time": "20:33 30/09/24",
            "Title": "https://t.co/xCW1UtqQ4m",
            "Date": "2024-09-30"
        },
        {
            "Message ID": 2994,
            "Group": "threeam",
            "Approx. Time": "18:43 30/09/24",
            "Title": "https://t.co/Lk9GBAemiu",
            "Date": "2024-09-30"
        },
        {
            "Message ID": 2993,
            "Group": "threeam",
            "Approx. Time": "18:43 30/09/24",
            "Title": "https://t.co/52P52MCIuk",
            "Date": "2024-09-30"
        },
        {
            "Message ID": 2992,
            "Group": "threeam",
            "Approx. Time": "18:43 30/09/24",
            "Title": "https://t.co/p5dEaDvaMY",
            "Date": "2024-09-30"
        },
        {
            "Message ID": 2991,
            "Group": "threeam",
            "Approx. Time": "18:43 30/09/24",
            "Title": "https://t.co/6PubeZ3EWO",
            "Date": "2024-09-30"
        },
        {
            "Message ID": 2990,
            "Group": "threeam",
            "Approx. Time": "18:43 30/09/24",
            "Title": "https://t.co/88anmnGObF",
            "Date": "2024-09-30"
        },
        {
            "Message ID": 2989,
            "Group": "qilin",
            "Approx. Time": "18:43 30/09/24",
            "Title": "Keller Williams Realty Group",
            "Date": "2024-09-30"
        }
    ],
    "RansomfeedNews": [
        {
            "Message ID": 3568,
            "ID": "17799",
            "Date": "2024-10-07",
            "Ransomware Group": "meow",
            "Victim": "The Superior Court of California, USA",
            "URLs": [
                "ransomfeed.it/index.php?page=post_details&id_post=17799"
            ]
        },
        {
            "Message ID": 3567,
            "ID": "17798",
            "Date": "2024-10-07",
            "Ransomware Group": "bianlian",
            "Victim": "Pearl Cohen, Israel",
            "URLs": [
                "ransomfeed.it/index.php?page=post_details&id_post=17798"
            ]
        },
        {
            "Message ID": 3566,
            "ID": "17797",
            "Date": "2024-10-07",
            "Ransomware Group": "killsec",
            "Victim": "yassir.com, Algeria",
            "URLs": [
                "yassir.com",
                "ransomfeed.it/index.php?page=post_details&id_post=17797"
            ]
        },
        {
            "Message ID": 3565,
            "ID": "17796",
            "Date": "2024-10-07",
            "Ransomware Group": "everest",
            "Victim": "Broward Realty Corp, USA",
            "URLs": [
                "ransomfeed.it/index.php?page=post_details&id_post=17796"
            ]
        },
        {
            "Message ID": 3564,
            "ID": "17794",
            "Date": "2024-10-07",
            "Ransomware Group": "lockbit3",
            "Victim": "tpgagedcare.com.au, Australia",
            "URLs": [
                "tpgagedcare.com.au",
                "ransomfeed.it/index.php?page=post_details&id_post=17794"
            ]
        },
        {
            "Message ID": 3563,
            "ID": "N/A",
            "Date": "2024-10-06",
            "Ransomware Group": "N/A",
            "Victim": "N/A",
            "URLs": []
        },
        {
            "Message ID": 3562,
            "ID": "17792",
            "Date": "2024-10-06",
            "Ransomware Group": "stormous",
            "Victim": "AOSense/NASA, USA",
            "URLs": [
                "ransomfeed.it/index.php?page=post_details&id_post=17792"
            ]
        },
        {
            "Message ID": 3561,
            "ID": "17791",
            "Date": "2024-10-06",
            "Ransomware Group": "stormous",
            "Victim": "lyra.officegroup.it, Italy",
            "URLs": [
                "lyra.officegroup.it",
                "ransomfeed.it/index.php?page=post_details&id_post=17791"
            ]
        },
        {
            "Message ID": 3560,
            "ID": "17790",
            "Date": "2024-10-06",
            "Ransomware Group": "play",
            "Victim": "Power Torque Services, USA",
            "URLs": [
                "ransomfeed.it/index.php?page=post_details&id_post=17790"
            ]
        },
        {
            "Message ID": 3559,
            "ID": "17789",
            "Date": "2024-10-06",
            "Ransomware Group": "killsec",
            "Victim": "seoulpi.io, South Korea",
            "URLs": [
                "seoulpi.io",
                "ransomfeed.it/index.php?page=post_details&id_post=17789"
            ]
        },
        {
            "Message ID": 3558,
            "ID": "17788",
            "Date": "2024-10-06",
            "Ransomware Group": "play",
            "Victim": "Creative Consumer Concepts, USA",
            "URLs": [
                "ransomfeed.it/index.php?page=post_details&id_post=17788"
            ]
        },
        {
            "Message ID": 3556,
            "ID": "17786",
            "Date": "2024-10-06",
            "Ransomware Group": "ransomhub",
            "Victim": "www.ravencm.com, USA",
            "URLs": [
                "www.ravencm.com",
                "ransomfeed.it/index.php?page=post_details&id_post=17786"
            ]
        },
        {
            "Message ID": 3555,
            "ID": "17785",
            "Date": "2024-10-06",
            "Ransomware Group": "ransomhub",
            "Victim": "canstarrestorations.com, Canada",
            "URLs": [
                "canstarrestorations.com",
                "ransomfeed.it/index.php?page=post_details&id_post=17785"
            ]
        },
        {
            "Message ID": 3553,
            "ID": "17783",
            "Date": "2024-10-06",
            "Ransomware Group": "hunters",
            "Victim": "Ibermutuamur, Spain",
            "URLs": [
                "ransomfeed.it/index.php?page=post_details&id_post=17783"
            ]
        },
        {
            "Message ID": 3552,
            "ID": "17782",
            "Date": "2024-10-05",
            "Ransomware Group": "killsec",
            "Victim": "betterhalf.ai, India",
            "URLs": [
                "betterhalf.ai",
                "ransomfeed.it/index.php?page=post_details&id_post=17782"
            ]
        },
        {
            "Message ID": 3551,
            "ID": "17781",
            "Date": "2024-10-05",
            "Ransomware Group": "clop",
            "Victim": "HARTSON-KENNEDY.COM, USA",
            "URLs": [
                "HARTSON-KENNEDY.COM",
                "ransomfeed.it/index.php?page=post_details&id_post=17781"
            ]
        },
        {
            "Message ID": 3550,
            "ID": "17780",
            "Date": "2024-10-05",
            "Ransomware Group": "hunters",
            "Victim": "BNBuilders, USA",
            "URLs": [
                "ransomfeed.it/index.php?page=post_details&id_post=17780"
            ]
        },
        {
            "Message ID": 3549,
            "ID": "17779",
            "Date": "2024-10-05",
            "Ransomware Group": "ransomhub",
            "Victim": "omniboxx.nl, Netherlands",
            "URLs": [
                "omniboxx.nl",
                "ransomfeed.it/index.php?page=post_details&id_post=17779"
            ]
        },
        {
            "Message ID": 3548,
            "ID": "17777",
            "Date": "2024-10-05",
            "Ransomware Group": "ransomhub",
            "Victim": "winwinza.com, South Africa",
            "URLs": [
                "winwinza.com",
                "ransomfeed.it/index.php?page=post_details&id_post=17777"
            ]
        },
        {
            "Message ID": 3547,
            "ID": "17776",
            "Date": "2024-10-05",
            "Ransomware Group": "incransom",
            "Victim": "Storck-Baugesellschaft mbH, Germany",
            "URLs": [
                "ransomfeed.it/index.php?page=post_details&id_post=17776"
            ]
        },
        {
            "Message ID": 3546,
            "ID": "17775",
            "Date": "2024-10-05",
            "Ransomware Group": "play",
            "Victim": "Wilmington Convention Center, USA",
            "URLs": [
                "ransomfeed.it/index.php?page=post_details&id_post=17775"
            ]
        },
        {
            "Message ID": 3545,
            "ID": "17774",
            "Date": "2024-10-05",
            "Ransomware Group": "play",
            "Victim": "Guerriere  AND  Halnon, USA",
            "URLs": [
                "ransomfeed.it/index.php?page=post_details&id_post=17774"
            ]
        },
        {
            "Message ID": 3544,
            "ID": "17773",
            "Date": "2024-10-05",
            "Ransomware Group": "play",
            "Victim": "Markdom Plastic Products, Canada",
            "URLs": [
                "ransomfeed.it/index.php?page=post_details&id_post=17773"
            ]
        },
        {
            "Message ID": 3543,
            "ID": "17772",
            "Date": "2024-10-05",
            "Ransomware Group": "play",
            "Victim": "Pete's Road Service, USA",
            "URLs": [
                "ransomfeed.it/index.php?page=post_details&id_post=17772"
            ]
        },
        {
            "Message ID": 3542,
            "ID": "17771",
            "Date": "2024-10-05",
            "Ransomware Group": "play",
            "Victim": "C AND L Ward, USA",
            "URLs": [
                "ransomfeed.it/index.php?page=post_details&id_post=17771"
            ]
        },
        {
            "Message ID": 3541,
            "ID": "17770",
            "Date": "2024-10-05",
            "Ransomware Group": "ransomhub",
            "Victim": "kleberandassociates.com, USA",
            "URLs": [
                "kleberandassociates.com",
                "ransomfeed.it/index.php?page=post_details&id_post=17770"
            ]
        },
        {
            "Message ID": 3540,
            "ID": "17769",
            "Date": "2024-10-05",
            "Ransomware Group": "ransomhub",
            "Victim": "releese.io, Canada",
            "URLs": [
                "releese.io",
                "ransomfeed.it/index.php?page=post_details&id_post=17769"
            ]
        },
        {
            "Message ID": 3539,
            "ID": "17767",
            "Date": "2024-10-04",
            "Ransomware Group": "ElDorado",
            "Victim": "mullenwylie.com, USA",
            "URLs": [
                "mullenwylie.com",
                "ransomfeed.it/index.php?page=post_details&id_post=17767"
            ]
        },
        {
            "Message ID": 3538,
            "ID": "17766",
            "Date": "2024-10-04",
            "Ransomware Group": "blacksuit",
            "Victim": "GenPro Inc., USA",
            "URLs": [
                "ransomfeed.it/index.php?page=post_details&id_post=17766"
            ]
        },
        {
            "Message ID": 3537,
            "ID": "17765",
            "Date": "2024-10-04",
            "Ransomware Group": "ciphbit",
            "Victim": "CopySmart LLC, USA",
            "URLs": [
                "ransomfeed.it/index.php?page=post_details&id_post=17765"
            ]
        },
        {
            "Message ID": 3536,
            "ID": "17764",
            "Date": "2024-10-04",
            "Ransomware Group": "hunters",
            "Victim": "Amplitude Laser, France",
            "URLs": [
                "ransomfeed.it/index.php?page=post_details&id_post=17764"
            ]
        },
        {
            "Message ID": 3535,
            "ID": "17763",
            "Date": "2024-10-04",
            "Ransomware Group": "akira",
            "Victim": "TANYA Creations, USA",
            "URLs": [
                "ransomfeed.it/index.php?page=post_details&id_post=17763"
            ]
        },
        {
            "Message ID": 3534,
            "ID": "17762",
            "Date": "2024-10-04",
            "Ransomware Group": "akira",
            "Victim": "Riley Gear Corporation, USA",
            "URLs": [
                "ransomfeed.it/index.php?page=post_details&id_post=17762"
            ]
        },
        {
            "Message ID": 3533,
            "ID": "17761",
            "Date": "2024-10-04",
            "Ransomware Group": "hunters",
            "Victim": "GW Mechanical, USA",
            "URLs": [
                "ransomfeed.it/index.php?page=post_details&id_post=17761"
            ]
        },
        {
            "Message ID": 3532,
            "ID": "17760",
            "Date": "2024-10-04",
            "Ransomware Group": "hunters",
            "Victim": "Dreyfuss + Blackford Architecture, USA",
            "URLs": [
                "ransomfeed.it/index.php?page=post_details&id_post=17760"
            ]
        },
        {
            "Message ID": 3531,
            "ID": "17759",
            "Date": "2024-10-04",
            "Ransomware Group": "akira",
            "Victim": "North American Breaker, USA",
            "URLs": [
                "ransomfeed.it/index.php?page=post_details&id_post=17759"
            ]
        },
        {
            "Message ID": 3530,
            "ID": "17758",
            "Date": "2024-10-04",
            "Ransomware Group": "orca",
            "Victim": "Transtec SAS, Colombia",
            "URLs": [
                "ransomfeed.it/index.php?page=post_details&id_post=17758"
            ]
        },
        {
            "Message ID": 3529,
            "ID": "17757",
            "Date": "2024-10-04",
            "Ransomware Group": "ransomhub",
            "Victim": "enterpriseoutsourcing.com, South Africa",
            "URLs": [
                "enterpriseoutsourcing.com",
                "ransomfeed.it/index.php?page=post_details&id_post=17757"
            ]
        },
        {
            "Message ID": 3528,
            "ID": "17756",
            "Date": "2024-10-04",
            "Ransomware Group": "ransomhouse",
            "Victim": "Fursan Travel, Saudi Arabia",
            "URLs": [
                "ransomfeed.it/index.php?page=post_details&id_post=17756"
            ]
        },
        {
            "Message ID": 3527,
            "ID": "17755",
            "Date": "2024-10-04",
            "Ransomware Group": "dragonforce",
            "Victim": "Lyomark Pharma, Germany",
            "URLs": [
                "ransomfeed.it/index.php?page=post_details&id_post=17755"
            ]
        },
        {
            "Message ID": 3526,
            "ID": "17754",
            "Date": "2024-10-04",
            "Ransomware Group": "qilin",
            "Victim": "McGaughey  AND  Keaney CPAs, USA",
            "URLs": [
                "ransomfeed.it/index.php?page=post_details&id_post=17754"
            ]
        },
        {
            "Message ID": 3525,
            "ID": "17753",
            "Date": "2024-10-04",
            "Ransomware Group": "qilin",
            "Victim": "DPC DATA, USA",
            "URLs": [
                "ransomfeed.it/index.php?page=post_details&id_post=17753"
            ]
        },
        {
            "Message ID": 3524,
            "ID": "17752",
            "Date": "2024-10-04",
            "Ransomware Group": "cicada3301",
            "Victim": "Conductive Containers, Inc, USA",
            "URLs": [
                "ransomfeed.it/index.php?page=post_details&id_post=17752"
            ]
        },
        {
            "Message ID": 3523,
            "ID": "17751",
            "Date": "2024-10-04",
            "Ransomware Group": "killsec",
            "Victim": "bbgc.gov.bd, Bangladesh",
            "URLs": [
                "bbgc.gov.bd",
                "ransomfeed.it/index.php?page=post_details&id_post=17751"
            ]
        },
        {
            "Message ID": 3522,
            "ID": "17750",
            "Date": "2024-10-04",
            "Ransomware Group": "handala",
            "Victim": "Shin Bet, Israel",
            "URLs": [
                "ransomfeed.it/index.php?page=post_details&id_post=17750"
            ]
        },
        {
            "Message ID": 3521,
            "ID": "17749",
            "Date": "2024-10-04",
            "Ransomware Group": "trinity",
            "Victim": "Barnes  AND  Cohen, USA",
            "URLs": [
                "ransomfeed.it/index.php?page=post_details&id_post=17749"
            ]
        },
        {
            "Message ID": 3520,
            "ID": "17748",
            "Date": "2024-10-04",
            "Ransomware Group": "hunters",
            "Victim": "CobelPlast, Belgium",
            "URLs": [
                "ransomfeed.it/index.php?page=post_details&id_post=17748"
            ]
        },
        {
            "Message ID": 3519,
            "ID": "17747",
            "Date": "2024-10-03",
            "Ransomware Group": "nitrogen",
            "Victim": "Red Barrels, Canada",
            "URLs": [
                "ransomfeed.it/index.php?page=post_details&id_post=17747"
            ]
        },
        {
            "Message ID": 3518,
            "ID": "17746",
            "Date": "2024-10-03",
            "Ransomware Group": "akira",
            "Victim": "Rob Levine  AND  Associates (roblevine.com), USA",
            "URLs": [
                "roblevine.com",
                "ransomfeed.it/index.php?page=post_details&id_post=17746"
            ]
        },
        {
            "Message ID": 3517,
            "ID": "17745",
            "Date": "2024-10-03",
            "Ransomware Group": "akira",
            "Victim": "TRC Worldwide Engineering (Trcww), USA",
            "URLs": [
                "ransomfeed.it/index.php?page=post_details&id_post=17745"
            ]
        },
        {
            "Message ID": 3516,
            "ID": "17744",
            "Date": "2024-10-03",
            "Ransomware Group": "clop",
            "Victim": "LIFTING.COM, USA",
            "URLs": [
                "LIFTING.COM",
                "ransomfeed.it/index.php?page=post_details&id_post=17744"
            ]
        },
        {
            "Message ID": 3515,
            "ID": "17743",
            "Date": "2024-10-03",
            "Ransomware Group": "hunters",
            "Victim": "CaleyWray, Canada",
            "URLs": [
                "ransomfeed.it/index.php?page=post_details&id_post=17743"
            ]
        },
        {
            "Message ID": 3514,
            "ID": "17742",
            "Date": "2024-10-03",
            "Ransomware Group": "medusa",
            "Victim": "Emerson, USA",
            "URLs": [
                "ransomfeed.it/index.php?page=post_details&id_post=17742"
            ]
        },
        {
            "Message ID": 3513,
            "ID": "17740",
            "Date": "2024-10-03",
            "Ransomware Group": "rhysida",
            "Victim": "Golden Age Nursing Home, USA",
            "URLs": [
                "ransomfeed.it/index.php?page=post_details&id_post=17740"
            ]
        },
        {
            "Message ID": 3512,
            "ID": "17736",
            "Date": "2024-10-03",
            "Ransomware Group": "ransomhub",
            "Victim": "rollxvans.com, USA",
            "URLs": [
                "rollxvans.com",
                "ransomfeed.it/index.php?page=post_details&id_post=17736"
            ]
        },
        {
            "Message ID": 3511,
            "ID": "17735",
            "Date": "2024-10-03",
            "Ransomware Group": "ransomhub",
            "Victim": "ironmetals.com, USA",
            "URLs": [
                "ironmetals.com",
                "ransomfeed.it/index.php?page=post_details&id_post=17735"
            ]
        },
        {
            "Message ID": 3510,
            "ID": "17734",
            "Date": "2024-10-03",
            "Ransomware Group": "ransomhub",
            "Victim": "domainindustries.com, USA",
            "URLs": [
                "domainindustries.com",
                "ransomfeed.it/index.php?page=post_details&id_post=17734"
            ]
        },
        {
            "Message ID": 3509,
            "ID": "17733",
            "Date": "2024-10-03",
            "Ransomware Group": "ransomhub",
            "Victim": "bypeterandpauls.com, Canada",
            "URLs": [
                "bypeterandpauls.com",
                "ransomfeed.it/index.php?page=post_details&id_post=17733"
            ]
        },
        {
            "Message ID": 3508,
            "ID": "17732",
            "Date": "2024-10-03",
            "Ransomware Group": "ransomhub",
            "Victim": "mccartycompany.com, USA",
            "URLs": [
                "mccartycompany.com",
                "ransomfeed.it/index.php?page=post_details&id_post=17732"
            ]
        },
        {
            "Message ID": 3507,
            "ID": "17731",
            "Date": "2024-10-03",
            "Ransomware Group": "blacksuit",
            "Victim": "Branhaven Chrysler Dodge Jeep Ram, USA",
            "URLs": [
                "ransomfeed.it/index.php?page=post_details&id_post=17731"
            ]
        },
        {
            "Message ID": 3506,
            "ID": "17730",
            "Date": "2024-10-02",
            "Ransomware Group": "akira",
            "Victim": "ETC Companies, USA",
            "URLs": [
                "ransomfeed.it/index.php?page=post_details&id_post=17730"
            ]
        },
        {
            "Message ID": 3505,
            "ID": "17729",
            "Date": "2024-10-02",
            "Ransomware Group": "handala",
            "Victim": "Israel Prime Minister Emails, Israel",
            "URLs": [
                "ransomfeed.it/index.php?page=post_details&id_post=17729"
            ]
        },
        {
            "Message ID": 3504,
            "ID": "17728",
            "Date": "2024-10-02",
            "Ransomware Group": "akira",
            "Victim": "Holmes  AND  Brakel, Canada",
            "URLs": [
                "ransomfeed.it/index.php?page=post_details&id_post=17728"
            ]
        },
        {
            "Message ID": 3503,
            "ID": "17727",
            "Date": "2024-10-02",
            "Ransomware Group": "qilin",
            "Victim": "Forshey Prostok LLP, USA",
            "URLs": [
                "ransomfeed.it/index.php?page=post_details&id_post=17727"
            ]
        },
        {
            "Message ID": 3502,
            "ID": "17726",
            "Date": "2024-10-02",
            "Ransomware Group": "trinity",
            "Victim": "FoccoERP, Brazil",
            "URLs": [
                "ransomfeed.it/index.php?page=post_details&id_post=17726"
            ]
        },
        {
            "Message ID": 3501,
            "ID": "17725",
            "Date": "2024-10-02",
            "Ransomware Group": "incransom",
            "Victim": "Quantum Healthcare, USA",
            "URLs": [
                "ransomfeed.it/index.php?page=post_details&id_post=17725"
            ]
        },
        {
            "Message ID": 3500,
            "ID": "17723",
            "Date": "2024-10-02",
            "Ransomware Group": "stormous",
            "Victim": "Acuity Advisor, UK",
            "URLs": [
                "ransomfeed.it/index.php?page=post_details&id_post=17723"
            ]
        },
        {
            "Message ID": 3499,
            "ID": "17722",
            "Date": "2024-10-02",
            "Ransomware Group": "stormous",
            "Victim": "asobostudio, France",
            "URLs": [
                "ransomfeed.it/index.php?page=post_details&id_post=17722"
            ]
        },
        {
            "Message ID": 3498,
            "ID": "17721",
            "Date": "2024-10-02",
            "Ransomware Group": "nitrogen",
            "Victim": "Akromold, Canada",
            "URLs": [
                "ransomfeed.it/index.php?page=post_details&id_post=17721"
            ]
        },
        {
            "Message ID": 3497,
            "ID": "17720",
            "Date": "2024-10-02",
            "Ransomware Group": "nitrogen",
            "Victim": "Labib Funk Associates, USA",
            "URLs": [
                "ransomfeed.it/index.php?page=post_details&id_post=17720"
            ]
        },
        {
            "Message ID": 3496,
            "ID": "17719",
            "Date": "2024-10-02",
            "Ransomware Group": "nitrogen",
            "Victim": "Research Electronics International, USA",
            "URLs": [
                "ransomfeed.it/index.php?page=post_details&id_post=17719"
            ]
        },
        {
            "Message ID": 3494,
            "ID": "17717",
            "Date": "2024-10-02",
            "Ransomware Group": "madliberator",
            "Victim": "marthamedeiros.com.br, Brazil",
            "URLs": [
                "marthamedeiros.com.br",
                "ransomfeed.it/index.php?page=post_details&id_post=17717"
            ]
        },
        {
            "Message ID": 3493,
            "ID": "17716",
            "Date": "2024-10-02",
            "Ransomware Group": "ElDorado",
            "Victim": "aberdeenwa.gov, USA",
            "URLs": [
                "aberdeenwa.gov",
                "ransomfeed.it/index.php?page=post_details&id_post=17716"
            ]
        },
        {
            "Message ID": 3492,
            "ID": "17715",
            "Date": "2024-10-02",
            "Ransomware Group": "qilin",
            "Victim": "United Animal Health, USA",
            "URLs": [
                "ransomfeed.it/index.php?page=post_details&id_post=17715"
            ]
        },
        {
            "Message ID": 3491,
            "ID": "17714",
            "Date": "2024-10-01",
            "Ransomware Group": "akira",
            "Victim": "ShoreMaster, USA",
            "URLs": [
                "ransomfeed.it/index.php?page=post_details&id_post=17714"
            ]
        },
        {
            "Message ID": 3490,
            "ID": "17713",
            "Date": "2024-10-01",
            "Ransomware Group": "akira",
            "Victim": "Cascade Columbia Distribution, USA",
            "URLs": [
                "ransomfeed.it/index.php?page=post_details&id_post=17713"
            ]
        },
        {
            "Message ID": 3489,
            "ID": "17710",
            "Date": "2024-10-01",
            "Ransomware Group": "akira",
            "Victim": "CSG Consultants, USA",
            "URLs": [
                "ransomfeed.it/index.php?page=post_details&id_post=17710"
            ]
        },
        {
            "Message ID": 3487,
            "ID": "17701",
            "Date": "2024-10-01",
            "Ransomware Group": "cactus",
            "Victim": "www.galab.com, Germany",
            "URLs": [
                "www.galab.com",
                "ransomfeed.it/index.php?page=post_details&id_post=17701"
            ]
        },
        {
            "Message ID": 3486,
            "ID": "17700",
            "Date": "2024-10-01",
            "Ransomware Group": "qilin",
            "Victim": "performance-therapies, USA",
            "URLs": [
                "ransomfeed.it/index.php?page=post_details&id_post=17700"
            ]
        },
        {
            "Message ID": 3485,
            "ID": "17699",
            "Date": "2024-10-01",
            "Ransomware Group": "meow",
            "Victim": "Corantioquia, Colombia",
            "URLs": [
                "ransomfeed.it/index.php?page=post_details&id_post=17699"
            ]
        },
        {
            "Message ID": 3483,
            "ID": "17697",
            "Date": "2024-10-01",
            "Ransomware Group": "killsec",
            "Victim": "telehealthcenter.in, India",
            "URLs": [
                "telehealthcenter.in",
                "ransomfeed.it/index.php?page=post_details&id_post=17697"
            ]
        },
        {
            "Message ID": 3482,
            "ID": "17696",
            "Date": "2024-10-01",
            "Ransomware Group": "ElDorado",
            "Victim": "howardcpas.com, USA",
            "URLs": [
                "howardcpas.com",
                "ransomfeed.it/index.php?page=post_details&id_post=17696"
            ]
        },
        {
            "Message ID": 3481,
            "ID": "17695",
            "Date": "2024-10-01",
            "Ransomware Group": "ElDorado",
            "Victim": "bshsoft.com, UAE",
            "URLs": [
                "bshsoft.com",
                "ransomfeed.it/index.php?page=post_details&id_post=17695"
            ]
        },
        {
            "Message ID": 3480,
            "ID": "17694",
            "Date": "2024-10-01",
            "Ransomware Group": "killsec",
            "Victim": "credihealth.com, India",
            "URLs": [
                "credihealth.com",
                "ransomfeed.it/index.php?page=post_details&id_post=17694"
            ]
        },
        {
            "Message ID": 3479,
            "ID": "17692",
            "Date": "2024-10-01",
            "Ransomware Group": "threeam",
            "Victim": "verco.co.uk, UK",
            "URLs": [
                "verco.co.uk",
                "ransomfeed.it/index.php?page=post_details&id_post=17692"
            ]
        },
        {
            "Message ID": 3478,
            "ID": "17691",
            "Date": "2024-10-01",
            "Ransomware Group": "nitrogen",
            "Victim": "IDEALEASE INC, USA",
            "URLs": [
                "ransomfeed.it/index.php?page=post_details&id_post=17691"
            ]
        },
        {
            "Message ID": 3477,
            "ID": "17690",
            "Date": "2024-10-01",
            "Ransomware Group": "nitrogen",
            "Victim": "Control Panels USA, USA",
            "URLs": [
                "ransomfeed.it/index.php?page=post_details&id_post=17690"
            ]
        },
        {
            "Message ID": 3476,
            "ID": "17689",
            "Date": "2024-10-01",
            "Ransomware Group": "nitrogen",
            "Victim": "Spectrum Industries, USA",
            "URLs": [
                "ransomfeed.it/index.php?page=post_details&id_post=17689"
            ]
        },
        {
            "Message ID": 3475,
            "ID": "17688",
            "Date": "2024-10-01",
            "Ransomware Group": "nitrogen",
            "Victim": "Magenta Photo Studio, Canada",
            "URLs": [
                "ransomfeed.it/index.php?page=post_details&id_post=17688"
            ]
        },
        {
            "Message ID": 3474,
            "ID": "17687",
            "Date": "2024-10-01",
            "Ransomware Group": "nitrogen",
            "Victim": "Brechbuhler Scales Inc, USA",
            "URLs": [
                "ransomfeed.it/index.php?page=post_details&id_post=17687"
            ]
        },
        {
            "Message ID": 3473,
            "ID": "17686",
            "Date": "2024-10-01",
            "Ransomware Group": "nitrogen",
            "Victim": "MDSi INC, USA",
            "URLs": [
                "ransomfeed.it/index.php?page=post_details&id_post=17686"
            ]
        },
        {
            "Message ID": 3472,
            "ID": "17685",
            "Date": "2024-10-01",
            "Ransomware Group": "medusa",
            "Victim": "Travel Alberta, Canada",
            "URLs": [
                "ransomfeed.it/index.php?page=post_details&id_post=17685"
            ]
        },
        {
            "Message ID": 3471,
            "ID": "17684",
            "Date": "2024-10-01",
            "Ransomware Group": "threeam",
            "Victim": "carlile-group.com, USA",
            "URLs": [
                "carlile-group.com",
                "ransomfeed.it/index.php?page=post_details&id_post=17684"
            ]
        },
        {
            "Message ID": 3470,
            "ID": "17683",
            "Date": "2024-10-01",
            "Ransomware Group": "threeam",
            "Victim": "sacredheart.southwark.sch, UK",
            "URLs": [
                "sacredheart.southwark.sch",
                "ransomfeed.it/index.php?page=post_details&id_post=17683"
            ]
        },
        {
            "Message ID": 3469,
            "ID": "17682",
            "Date": "2024-10-01",
            "Ransomware Group": "threeam",
            "Victim": "mctas.org.au, Australia",
            "URLs": [
                "mctas.org.au",
                "ransomfeed.it/index.php?page=post_details&id_post=17682"
            ]
        },
        {
            "Message ID": 3468,
            "ID": "17681",
            "Date": "2024-10-01",
            "Ransomware Group": "threeam",
            "Victim": "mnpl.com.sg, Singapore",
            "URLs": [
                "mnpl.com.sg",
                "ransomfeed.it/index.php?page=post_details&id_post=17681"
            ]
        },
        {
            "Message ID": 3467,
            "ID": "17680",
            "Date": "2024-10-01",
            "Ransomware Group": "killsec",
            "Victim": "itap.nacc.go.th, Thailand",
            "URLs": [
                "itap.nacc.go.th",
                "ransomfeed.it/index.php?page=post_details&id_post=17680"
            ]
        },
        {
            "Message ID": 3466,
            "ID": "17679",
            "Date": "2024-10-01",
            "Ransomware Group": "medusa",
            "Victim": "BELL DATA, Inc, Japan",
            "URLs": [
                "ransomfeed.it/index.php?page=post_details&id_post=17679"
            ]
        },
        {
            "Message ID": 3465,
            "ID": "17678",
            "Date": "2024-09-30",
            "Ransomware Group": "meow",
            "Victim": "Community Hospital of Anaconda, USA",
            "URLs": [
                "ransomfeed.it/index.php?page=post_details&id_post=17678"
            ]
        },
        {
            "Message ID": 3464,
            "ID": "17677",
            "Date": "2024-09-30",
            "Ransomware Group": "blackbyte",
            "Victim": "TOTVS, Brazil",
            "URLs": [
                "ransomfeed.it/index.php?page=post_details&id_post=17677"
            ]
        }
    ],
    "Yldz Threat Intelligence News": [
        {
            "Message ID": 2724,
            "Victim": "IIB ( Israeli Industrial Batteries ) Leaked",
            "Attacker": "Handala",
            "Disclosure Date": "06.10.2024",
            "Leak Data Information": "Company Information",
            "Date": "2024-10-06"
        },
        {
            "Message ID": 2723,
            "Victim": "Storck-Baugesellschaft mbH",
            "Attacker": "INC Ransom",
            "Disclosure Date": "05.10.2024",
            "Leak Data Information": "Company Information",
            "Date": "2024-10-05"
        },
        {
            "Message ID": 2722,
            "Victim": "www[.]ravencm[.]com",
            "Attacker": "RansomHub",
            "Disclosure Date": "05.10.2024",
            "Leak Data Information": "Company Information",
            "Date": "2024-10-05"
        },
        {
            "Message ID": 2721,
            "Victim": "winwinza[.]com",
            "Attacker": "RansomHub",
            "Disclosure Date": "05.10.2024",
            "Leak Data Information": "Company Information",
            "Date": "2024-10-05"
        },
        {
            "Message ID": 2720,
            "Victim": "omniboxx[.]nl",
            "Attacker": "RansomHub",
            "Disclosure Date": "05.10.2024",
            "Leak Data Information": "Company Information",
            "Date": "2024-10-05"
        },
        {
            "Message ID": 2719,
            "Victim": "canstarrestorations[.]com",
            "Attacker": "RansomHub",
            "Disclosure Date": "05.10.2024",
            "Leak Data Information": "Company Information",
            "Date": "2024-10-05"
        },
        {
            "Message ID": 2718,
            "Victim": "Ibermutuamur",
            "Attacker": "Hunters",
            "Disclosure Date": "05.10.2024",
            "Leak Data Information": "Company Information",
            "Date": "2024-10-05"
        },
        {
            "Message ID": 2717,
            "Victim": "BNBuilders",
            "Attacker": "Hunters",
            "Disclosure Date": "05.10.2024",
            "Leak Data Information": "Company Information",
            "Date": "2024-10-05"
        },
        {
            "Message ID": 2716,
            "Victim": "betterhalf[.]ai",
            "Attacker": "KillSec",
            "Disclosure Date": "05.10.2024",
            "Leak Data Information": "Company Information",
            "Date": "2024-10-05"
        },
        {
            "Message ID": 2715,
            "Victim": "TANYA Creations",
            "Attacker": "Akira",
            "Disclosure Date": "04.10.2024",
            "Leak Data Information": "Company Information",
            "Date": "2024-10-04"
        },
        {
            "Message ID": 2714,
            "Victim": "Riley Gear Corporation",
            "Attacker": "Akira",
            "Disclosure Date": "04.10.2024",
            "Leak Data Information": "Company Information",
            "Date": "2024-10-04"
        },
        {
            "Message ID": 2713,
            "Victim": "North American Breaker",
            "Attacker": "Akira",
            "Disclosure Date": "04.10.2024",
            "Leak Data Information": "Company Information",
            "Date": "2024-10-04"
        },
        {
            "Message ID": 2712,
            "Victim": "Transtec SAS",
            "Attacker": "Orca",
            "Disclosure Date": "04.10.2024",
            "Leak Data Information": "Company Information",
            "Date": "2024-10-04"
        },
        {
            "Message ID": 2711,
            "Victim": "GenPro Inc",
            "Attacker": "Black Suit",
            "Disclosure Date": "04.10.2024",
            "Leak Data Information": "Company Information",
            "Date": "2024-10-04"
        },
        {
            "Message ID": 2710,
            "Victim": "Fursan Travel",
            "Attacker": "RansomHouse",
            "Disclosure Date": "04.10.2024",
            "Leak Data Information": "Company Information",
            "Date": "2024-10-04"
        },
        {
            "Message ID": 2709,
            "Victim": "releese[.]io",
            "Attacker": "RansomHub",
            "Disclosure Date": "04.10.2024",
            "Leak Data Information": "Company Information",
            "Date": "2024-10-04"
        },
        {
            "Message ID": 2708,
            "Victim": "kleberandassociates[.]com",
            "Attacker": "RansomHub",
            "Disclosure Date": "04.10.2024",
            "Leak Data Information": "Company Information",
            "Date": "2024-10-04"
        },
        {
            "Message ID": 2707,
            "Victim": "enterpriseoutsourcing[.]com",
            "Attacker": "RansomHub",
            "Disclosure Date": "04.10.2024",
            "Leak Data Information": "Company Information",
            "Date": "2024-10-04"
        },
        {
            "Message ID": 2706,
            "Victim": "DPC DATA",
            "Attacker": "Qilin",
            "Disclosure Date": "04.10.2024",
            "Leak Data Information": "Company Information",
            "Date": "2024-10-04"
        },
        {
            "Message ID": 2705,
            "Victim": "CopySmart LLC",
            "Attacker": "CiphBit",
            "Disclosure Date": "04.10.2024",
            "Leak Data Information": "Company Information",
            "Date": "2024-10-04"
        },
        {
            "Message ID": 2704,
            "Victim": "Conductive Containers, Inc",
            "Attacker": "Cicada3301",
            "Disclosure Date": "04.10.2024",
            "Leak Data Information": "Company Information",
            "Date": "2024-10-04"
        },
        {
            "Message ID": 2703,
            "Victim": "City Of Forest Park",
            "Attacker": "Monti",
            "Disclosure Date": "04.10.2024",
            "Leak Data Information": "Company Information",
            "Date": "2024-10-04"
        },
        {
            "Message ID": 2702,
            "Victim": "bbgc[.]gov[.]bd",
            "Attacker": "KillSec",
            "Disclosure Date": "04.10.2024",
            "Leak Data Information": "Company Information",
            "Date": "2024-10-04"
        },
        {
            "Message ID": 2701,
            "Victim": "GW Mechanical",
            "Attacker": "Hunters",
            "Disclosure Date": "04.10.2024",
            "Leak Data Information": "Company Information",
            "Date": "2024-10-04"
        },
        {
            "Message ID": 2700,
            "Victim": "Dreyfuss + Blackford Architecture",
            "Attacker": "Hunters",
            "Disclosure Date": "04.10.2024",
            "Leak Data Information": "Company Information",
            "Date": "2024-10-04"
        },
        {
            "Message ID": 2699,
            "Victim": "Amplitude Laser",
            "Attacker": "Hunters",
            "Disclosure Date": "04.10.2024",
            "Leak Data Information": "Company Information",
            "Date": "2024-10-04"
        },
        {
            "Message ID": 2698,
            "Victim": "Shin Bet Hacked",
            "Attacker": "Handala",
            "Disclosure Date": "03.10.2024",
            "Leak Data Information": "Company Information",
            "Date": "2024-10-03"
        },
        {
            "Message ID": 2697,
            "Victim": "TRC Worldwide Engineering (Trcww)",
            "Attacker": "Akira",
            "Disclosure Date": "03.10.2024",
            "Leak Data Information": "Company Information",
            "Date": "2024-10-03"
        },
        {
            "Message ID": 2696,
            "Victim": "Rob Levine & Associates (roblevine[.]com)",
            "Attacker": "Akira",
            "Disclosure Date": "03.10.2024",
            "Leak Data Information": "Company Information",
            "Date": "2024-10-03"
        },
        {
            "Message ID": 2695,
            "Victim": "Lymork Pharma",
            "Attacker": "DragonForce",
            "Disclosure Date": "03.10.2024",
            "Leak Data Information": "Company Information",
            "Date": "2024-10-03"
        },
        {
            "Message ID": 2694,
            "Victim": "Golden Age Nursing Home",
            "Attacker": "Rhysida",
            "Disclosure Date": "03.10.2024",
            "Leak Data Information": "Company Information",
            "Date": "2024-10-03"
        },
        {
            "Message ID": 2693,
            "Victim": "CaleyWray",
            "Attacker": "hunters",
            "Disclosure Date": "03.10.2024",
            "Leak Data Information": "Company Information",
            "Date": "2024-10-03"
        },
        {
            "Message ID": 2692,
            "Victim": "Barnes & Cohen",
            "Attacker": "trinity",
            "Disclosure Date": "03.10.2024",
            "Leak Data Information": "Company Information",
            "Date": "2024-10-03"
        },
        {
            "Message ID": 2691,
            "Victim": "FoccoERP",
            "Attacker": "trinity",
            "Disclosure Date": "02.10.2024",
            "Leak Data Information": "Company Information",
            "Date": "2024-10-02"
        },
        {
            "Message ID": 2690,
            "Victim": "Red Barrels",
            "Attacker": "Nitrogen",
            "Disclosure Date": "02.10.2024",
            "Leak Data Information": "Company Information",
            "Date": "2024-10-02"
        },
        {
            "Message ID": 2689,
            "Victim": "Israel Prime Minister Emails",
            "Attacker": "Handala",
            "Disclosure Date": "02.10.2024",
            "Leak Data Information": "Company Information",
            "Date": "2024-10-02"
        },
        {
            "Message ID": 2688,
            "Victim": "Quantum Healthcare",
            "Attacker": "INC Ransom",
            "Disclosure Date": "02.10.2024",
            "Leak Data Information": "Company Information",
            "Date": "2024-10-02"
        },
        {
            "Message ID": 2687,
            "Victim": "www[.]amchar[.]com",
            "Attacker": "Cactus",
            "Disclosure Date": "02.10.2024",
            "Leak Data Information": "Company Information",
            "Date": "2024-10-02"
        },
        {
            "Message ID": 2686,
            "Victim": "ten8fire[.]com",
            "Attacker": "Cactus",
            "Disclosure Date": "02.10.2024",
            "Leak Data Information": "Company Information",
            "Date": "2024-10-02"
        },
        {
            "Message ID": 2685,
            "Victim": "kjtait[.]com",
            "Attacker": "Cactus",
            "Disclosure Date": "02.10.2024",
            "Leak Data Information": "Company Information",
            "Date": "2024-10-02"
        },
        {
            "Message ID": 2684,
            "Victim": "hindlegroup[.]com",
            "Attacker": "Cactus",
            "Disclosure Date": "02.10.2024",
            "Leak Data Information": "Company Information",
            "Date": "2024-10-02"
        },
        {
            "Message ID": 2683,
            "Victim": "rollxvans[.]com",
            "Attacker": "RansomHub",
            "Disclosure Date": "02.10.2024",
            "Leak Data Information": "Company Information",
            "Date": "2024-10-02"
        },
        {
            "Message ID": 2682,
            "Victim": "mccartycompany[.]com",
            "Attacker": "RansomHub",
            "Disclosure Date": "02.10.2024",
            "Leak Data Information": "Company Information",
            "Date": "2024-10-02"
        },
        {
            "Message ID": 2681,
            "Victim": "ironmetals[.]com",
            "Attacker": "RansomHub",
            "Disclosure Date": "02.10.2024",
            "Leak Data Information": "Company Information",
            "Date": "2024-10-02"
        },
        {
            "Message ID": 2680,
            "Victim": "domainindustries[.]com",
            "Attacker": "RansomHub",
            "Disclosure Date": "02.10.2024",
            "Leak Data Information": "Company Information",
            "Date": "2024-10-02"
        },
        {
            "Message ID": 2679,
            "Victim": "bypeterandpauls[.]com",
            "Attacker": "RansomHub",
            "Disclosure Date": "02.10.2024",
            "Leak Data Information": "Company Information",
            "Date": "2024-10-02"
        },
        {
            "Message ID": 2678,
            "Victim": "Branhaven Chrysler Dodge Jeep Ram",
            "Attacker": "Black Suit",
            "Disclosure Date": "02.10.2024",
            "Leak Data Information": "Company Information",
            "Date": "2024-10-02"
        },
        {
            "Message ID": 2677,
            "Victim": "cdc-biodiversite[.]fr",
            "Attacker": "Blackout",
            "Disclosure Date": "29.09.2024",
            "Leak Data Information": "Company Information",
            "Date": "2024-09-29"
        },
        {
            "Message ID": 2676,
            "Victim": "nfefazenda[.]gov[.]br",
            "Attacker": "Killsec",
            "Disclosure Date": "29.09.2024",
            "Leak Data Information": "Company Information",
            "Date": "2024-09-29"
        },
        {
            "Message ID": 2675,
            "Victim": "markdom[.]com",
            "Attacker": "RansomHub",
            "Disclosure Date": "29.09.2024",
            "Leak Data Information": "Company Information",
            "Date": "2024-09-29"
        },
        {
            "Message ID": 2674,
            "Victim": "Divine Interprises INC",
            "Attacker": "INC Ransom",
            "Disclosure Date": "29.09.2024",
            "Leak Data Information": "Company Information",
            "Date": "2024-09-29"
        },
        {
            "Message ID": 2673,
            "Victim": "DINAS Corp",
            "Attacker": "INC Ransom",
            "Disclosure Date": "29.09.2024",
            "Leak Data Information": "Company Information",
            "Date": "2024-09-29"
        },
        {
            "Message ID": 2672,
            "Victim": "The Rubber Resources",
            "Attacker": "Play",
            "Disclosure Date": "29.09.2024",
            "Leak Data Information": "Company Information",
            "Date": "2024-09-29"
        },
        {
            "Message ID": 2671,
            "Victim": "G/S Solutions",
            "Attacker": "Play",
            "Disclosure Date": "29.09.2024",
            "Leak Data Information": "Company Information",
            "Date": "2024-09-29"
        },
        {
            "Message ID": 2670,
            "Victim": "Garvey",
            "Attacker": "Play",
            "Disclosure Date": "29.09.2024",
            "Leak Data Information": "Company Information",
            "Date": "2024-09-29"
        },
        {
            "Message ID": 2669,
            "Victim": "Condere Ip, Infracom Group",
            "Attacker": "Play",
            "Disclosure Date": "29.09.2024",
            "Leak Data Information": "Company Information",
            "Date": "2024-09-29"
        },
        {
            "Message ID": 2668,
            "Victim": "Classic Business Products",
            "Attacker": "Play",
            "Disclosure Date": "29.09.2024",
            "Leak Data Information": "Company Information",
            "Date": "2024-09-29"
        },
        {
            "Message ID": 2667,
            "Victim": "SaniRent",
            "Attacker": "Meow",
            "Disclosure Date": "29.09.2024",
            "Leak Data Information": "Company Information",
            "Date": "2024-09-29"
        },
        {
            "Message ID": 2666,
            "Victim": "OffRoadAction",
            "Attacker": "Meow",
            "Disclosure Date": "29.09.2024",
            "Leak Data Information": "Company Information",
            "Date": "2024-09-29"
        },
        {
            "Message ID": 2665,
            "Victim": "Moeller Door and Window",
            "Attacker": "Meow",
            "Disclosure Date": "29.09.2024",
            "Leak Data Information": "Company Information",
            "Date": "2024-09-29"
        },
        {
            "Message ID": 2664,
            "Victim": "Alvan Blanch",
            "Attacker": "Meow",
            "Disclosure Date": "29.09.2024",
            "Leak Data Information": "Company Information",
            "Date": "2024-09-29"
        },
        {
            "Message ID": 2663,
            "Victim": "PipelBiz[.]com",
            "Attacker": "RansomHub",
            "Disclosure Date": "28.09.2024",
            "Leak Data Information": "Company Information",
            "Date": "2024-09-28"
        },
        {
            "Message ID": 2662,
            "Victim": "Southern Fire Sprinkler",
            "Attacker": "ciphbit",
            "Disclosure Date": "28.09.2024",
            "Leak Data Information": "Company Information",
            "Date": "2024-09-28"
        },
        {
            "Message ID": 2661,
            "Victim": "Rros Hotell",
            "Attacker": "Medusa",
            "Disclosure Date": "28.09.2024",
            "Leak Data Information": "Company Information",
            "Date": "2024-09-28"
        },
        {
            "Message ID": 2660,
            "Victim": "www[.]contegritygroup[.]com",
            "Attacker": "RansomHub",
            "Disclosure Date": "28.09.2024",
            "Leak Data Information": "Company Information",
            "Date": "2024-09-28"
        },
        {
            "Message ID": 2659,
            "Victim": "Te***************.net",
            "Attacker": "cloak",
            "Disclosure Date": "28.09.2024",
            "Leak Data Information": "Company Information",
            "Date": "2024-09-28"
        },
        {
            "Message ID": 2658,
            "Victim": "Ful************.com",
            "Attacker": "cloak",
            "Disclosure Date": "28.09.2024",
            "Leak Data Information": "Company Information",
            "Date": "2024-09-28"
        },
        {
            "Message ID": 2657,
            "Victim": "infina[.]vn",
            "Attacker": "Killsec",
            "Disclosure Date": "27.09.2024",
            "Leak Data Information": "Company Information",
            "Date": "2024-09-27"
        },
        {
            "Message ID": 2656,
            "Victim": "wwwv[.]brlogisticacom[.]br",
            "Attacker": "RansomHub",
            "Disclosure Date": "27.09.2024",
            "Leak Data Information": "Company Information",
            "Date": "2024-09-27"
        },
        {
            "Message ID": 2655,
            "Victim": "www[.]tokiwa-group[.]co[.]jp",
            "Attacker": "RansomHub",
            "Disclosure Date": "27.09.2024",
            "Leak Data Information": "Company Information",
            "Date": "2024-09-27"
        },
        {
            "Message ID": 2654,
            "Victim": "www[.]naniwa-pump[.]co[.]jp",
            "Attacker": "RansomHub",
            "Disclosure Date": "27.09.2024",
            "Leak Data Information": "Company Information",
            "Date": "2024-09-27"
        },
        {
            "Message ID": 2653,
            "Victim": "www[.]law-taxes[.]pl",
            "Attacker": "RansomHub",
            "Disclosure Date": "27.09.2024",
            "Leak Data Information": "Company Information",
            "Date": "2024-09-27"
        },
        {
            "Message ID": 2652,
            "Victim": "www[.]careco[.]se",
            "Attacker": "RansomHub",
            "Disclosure Date": "27.09.2024",
            "Leak Data Information": "Company Information",
            "Date": "2024-09-27"
        },
        {
            "Message ID": 2651,
            "Victim": "actionfirepros[.]com_$174M_USA_407GB__1_ DISCLOSED",
            "Attacker": "Cactus",
            "Disclosure Date": "27.09.2024",
            "Leak Data Information": "Company Information",
            "Date": "2024-09-27"
        },
        {
            "Message ID": 2650,
            "Victim": "Shenango Area School District",
            "Attacker": "Rhysida",
            "Disclosure Date": "26.09.2024",
            "Leak Data Information": "Company Information",
            "Date": "2024-09-27"
        },
        {
            "Message ID": 2649,
            "Victim": "Mile Hi Foods",
            "Attacker": "Play",
            "Disclosure Date": "26.09.2024",
            "Leak Data Information": "Company Information",
            "Date": "2024-09-27"
        },
        {
            "Message ID": 2648,
            "Victim": "Israel foreign affairs minister Emails",
            "Attacker": "Handala",
            "Disclosure Date": "26.09.2024",
            "Leak Data Information": "Company Information",
            "Date": "2024-09-27"
        },
        {
            "Message ID": 2647,
            "Victim": "lolaliza[.]com - 250kk",
            "Attacker": "Black Suit",
            "Disclosure Date": "26.09.2024",
            "Leak Data Information": "Company Information",
            "Date": "2024-09-27"
        },
        {
            "Message ID": 2646,
            "Victim": "English Construction Company",
            "Attacker": "Lynx",
            "Disclosure Date": "26.09.2024",
            "Leak Data Information": "Company Information",
            "Date": "2024-09-27"
        },
        {
            "Message ID": 2645,
            "Victim": "DJH Jugendherberge",
            "Attacker": "Hunters",
            "Disclosure Date": "26.09.2024",
            "Leak Data Information": "Company Information",
            "Date": "2024-09-27"
        },
        {
            "Message ID": 2644,
            "Victim": "www[.]amchar[.]com_$287M_USA_605GB__1_ DISCLOSED",
            "Attacker": "Cactus",
            "Disclosure Date": "25.09.2024",
            "Leak Data Information": "Company Information",
            "Date": "2024-09-25"
        },
        {
            "Message ID": 2643,
            "Victim": "kjtait[.]com_$188M_United Kingdom_12TB__1_ DISCLOSED",
            "Attacker": "Cactus",
            "Disclosure Date": "25.09.2024",
            "Leak Data Information": "Company Information",
            "Date": "2024-09-25"
        },
        {
            "Message ID": 2642,
            "Victim": "hindlegroup[.]com_$306M_United Kingdom_380GB__1_ DISCLOSED",
            "Attacker": "Cactus",
            "Disclosure Date": "25.09.2024",
            "Leak Data Information": "Company Information",
            "Date": "2024-09-25"
        },
        {
            "Message ID": 2641,
            "Victim": "pennvet[.]com",
            "Attacker": "Cloak",
            "Disclosure Date": "25.09.2024",
            "Leak Data Information": "Company Information",
            "Date": "2024-09-25"
        },
        {
            "Message ID": 2640,
            "Victim": "triverus[.]com",
            "Attacker": "Lynx",
            "Disclosure Date": "25.09.2024",
            "Leak Data Information": "Company Information",
            "Date": "2024-09-25"
        },
        {
            "Message ID": 2639,
            "Victim": "Luso cuanza",
            "Attacker": "Qilin",
            "Disclosure Date": "25.09.2024",
            "Leak Data Information": "Company Information",
            "Date": "2024-09-25"
        },
        {
            "Message ID": 2638,
            "Victim": "kumhotire[.]com",
            "Attacker": "LockBit 3.0",
            "Disclosure Date": "25.09.2024",
            "Leak Data Information": "Company Information",
            "Date": "2024-09-25"
        },
        {
            "Message ID": 2637,
            "Victim": "Wilson & Lafleur",
            "Attacker": "Medusa",
            "Disclosure Date": "25.09.2024",
            "Leak Data Information": "Company Information",
            "Date": "2024-09-25"
        },
        {
            "Message ID": 2636,
            "Victim": "Xtera Communications",
            "Attacker": "Medusa",
            "Disclosure Date": "25.09.2024",
            "Leak Data Information": "Company Information",
            "Date": "2024-09-25"
        },
        {
            "Message ID": 2635,
            "Victim": "Concord Management Services",
            "Attacker": "Akira",
            "Disclosure Date": "25.09.2024",
            "Leak Data Information": "Company Information",
            "Date": "2024-09-25"
        },
        {
            "Message ID": 2634,
            "Victim": "Lawrie Insurance Group",
            "Attacker": "Akira",
            "Disclosure Date": "25.09.2024",
            "Leak Data Information": "Company Information",
            "Date": "2024-09-25"
        },
        {
            "Message ID": 2633,
            "Victim": "ATG Communications Group",
            "Attacker": "Akira",
            "Disclosure Date": "25.09.2024",
            "Leak Data Information": "Company Information",
            "Date": "2024-09-25"
        },
        {
            "Message ID": 2632,
            "Victim": "Solutii Sistemas",
            "Attacker": "Arcus Media",
            "Disclosure Date": "24.09.2024",
            "Leak Data Information": "Company Information",
            "Date": "2024-09-24"
        },
        {
            "Message ID": 2631,
            "Victim": "partners air",
            "Attacker": "Arcus Media",
            "Disclosure Date": "24.09.2024",
            "Leak Data Information": "Company Information",
            "Date": "2024-09-24"
        },
        {
            "Message ID": 2630,
            "Victim": "Nova Sinseg",
            "Attacker": "Arcus Media",
            "Disclosure Date": "24.09.2024",
            "Leak Data Information": "Company Information",
            "Date": "2024-09-24"
        },
        {
            "Message ID": 2629,
            "Victim": "Frigocenter",
            "Attacker": "Arcus Media",
            "Disclosure Date": "24.09.2024",
            "Leak Data Information": "Company Information",
            "Date": "2024-09-24"
        },
        {
            "Message ID": 2628,
            "Victim": "Israel defense minister private photos",
            "Attacker": "Handala",
            "Disclosure Date": "24.09.2024",
            "Leak Data Information": "Company Information",
            "Date": "2024-09-24"
        },
        {
            "Message ID": 2627,
            "Victim": "First Choice Sales & Marketing Group (First Choice)",
            "Attacker": "BianLian",
            "Disclosure Date": "24.09.2024",
            "Leak Data Information": "Company Information",
            "Date": "2024-09-24"
        },
        {
            "Message ID": 2626,
            "Victim": "Model Engineering",
            "Attacker": "Cicada3301",
            "Disclosure Date": "24.09.2024",
            "Leak Data Information": "Company Information",
            "Date": "2024-09-24"
        },
        {
            "Message ID": 2625,
            "Victim": "Crown Mortgage Company",
            "Attacker": "Cicada3301",
            "Disclosure Date": "24.09.2024",
            "Leak Data Information": "Company Information",
            "Date": "2024-09-24"
        }
    ],
    "Cyberthint's Dark Monitor": [
        {
            "Message ID": 86376,
            "Title": "N/A",
            "Date": "2024-10-07",
            "Source": "https://nvd.nist.gov/vuln/detail/CVE-2024-47968"
        },
        {
            "Message ID": 86375,
            "Title": "N/A",
            "Date": "2024-10-07",
            "Source": "https://nvd.nist.gov/vuln/detail/CVE-2024-47817"
        },
        {
            "Message ID": 86374,
            "Title": "N/A",
            "Date": "2024-10-07",
            "Source": "https://nvd.nist.gov/vuln/detail/CVE-2024-47782"
        },
        {
            "Message ID": 86373,
            "Title": "N/A",
            "Date": "2024-10-07",
            "Source": "https://nvd.nist.gov/vuln/detail/CVE-2024-47781"
        },
        {
            "Message ID": 86372,
            "Title": "LEGO's website hacked to push cryptocurrency scam",
            "Date": "2024-10-07",
            "Source": "https://www.bleepingcomputer.com/news/security/legos-website-hacked-to-push-cryptocurrency-scam/"
        },
        {
            "Message ID": 86371,
            "Title": "Anatomy of a Cyber Attack: The PAN-OS Firewall Zero-Day",
            "Date": "2024-10-07",
            "Source": "https://arcticwolf.com/resources/blog-uk/anatomy-of-a-cyber-attack-the-pan-os-firewall-zeroday/"
        },
        {
            "Message ID": 86370,
            "Title": "2024-10-07 - Data dump (Formbook, possible Astaroth/Guildma, Redline Stealer, unidentified malware)",
            "Date": "2024-10-07",
            "Source": "https://www.malware-traffic-analysis.net/2024/10/07/index.html"
        },
        {
            "Message ID": 86369,
            "Title": "Ukrainian pleads guilty to operating Raccoon Stealer malware",
            "Date": "2024-10-07",
            "Source": "https://www.bleepingcomputer.com/news/security/ukrainian-pleads-guilty-to-operating-raccoon-stealer-malware/"
        },
        {
            "Message ID": 86368,
            "Title": "N/A",
            "Date": "2024-10-07",
            "Source": "https://nvd.nist.gov/vuln/detail/CVE-2024-31227"
        },
        {
            "Message ID": 86367,
            "Title": "N/A",
            "Date": "2024-10-07",
            "Source": "https://nvd.nist.gov/vuln/detail/CVE-2024-31449"
        },
        {
            "Message ID": 86366,
            "Title": "N/A",
            "Date": "2024-10-07",
            "Source": "https://nvd.nist.gov/vuln/detail/CVE-2024-45051"
        },
        {
            "Message ID": 86365,
            "Title": "N/A",
            "Date": "2024-10-07",
            "Source": "https://nvd.nist.gov/vuln/detail/CVE-2024-45297"
        },
        {
            "Message ID": 86364,
            "Title": "N/A",
            "Date": "2024-10-07",
            "Source": "https://nvd.nist.gov/vuln/detail/CVE-2024-43789"
        },
        {
            "Message ID": 86363,
            "Title": "N/A",
            "Date": "2024-10-07",
            "Source": "https://nvd.nist.gov/vuln/detail/CVE-2024-9225"
        },
        {
            "Message ID": 86362,
            "Title": "N/A",
            "Date": "2024-10-07",
            "Source": "https://nvd.nist.gov/vuln/detail/CVE-2024-45293"
        },
        {
            "Message ID": 86361,
            "Title": "N/A",
            "Date": "2024-10-07",
            "Source": "https://nvd.nist.gov/vuln/detail/CVE-2024-45292"
        },
        {
            "Message ID": 86360,
            "Title": "N/A",
            "Date": "2024-10-07",
            "Source": "https://nvd.nist.gov/vuln/detail/CVE-2024-3037"
        },
        {
            "Message ID": 86359,
            "Title": "N/A",
            "Date": "2024-10-07",
            "Source": "https://nvd.nist.gov/vuln/detail/CVE-2024-9513"
        },
        {
            "Message ID": 86358,
            "Title": "N/A",
            "Date": "2024-10-07",
            "Source": "https://nvd.nist.gov/vuln/detail/CVE-2024-43362"
        },
        {
            "Message ID": 86357,
            "Title": "N/A",
            "Date": "2024-10-07",
            "Source": "https://nvd.nist.gov/vuln/detail/CVE-2024-43364"
        },
        {
            "Message ID": 86356,
            "Title": "N/A",
            "Date": "2024-10-07",
            "Source": "https://nvd.nist.gov/vuln/detail/CVE-2024-43365"
        },
        {
            "Message ID": 86355,
            "Title": "N/A",
            "Date": "2024-10-07",
            "Source": "https://nvd.nist.gov/vuln/detail/CVE-2024-8758"
        },
        {
            "Message ID": 86354,
            "Title": "N/A",
            "Date": "2024-10-07",
            "Source": "https://nvd.nist.gov/vuln/detail/CVE-2024-43363"
        },
        {
            "Message ID": 86353,
            "Title": "N/A",
            "Date": "2024-10-07",
            "Source": "https://nvd.nist.gov/vuln/detail/CVE-2024-47973"
        },
        {
            "Message ID": 86352,
            "Title": "N/A",
            "Date": "2024-10-07",
            "Source": "N/A"
        },
        {
            "Message ID": 86351,
            "Title": "N/A",
            "Date": "2024-10-07",
            "Source": "N/A"
        },
        {
            "Message ID": 86350,
            "Title": "N/A",
            "Date": "2024-10-07",
            "Source": "N/A"
        },
        {
            "Message ID": 86349,
            "Title": "N/A",
            "Date": "2024-10-07",
            "Source": "N/A"
        },
        {
            "Message ID": 86348,
            "Title": "N/A",
            "Date": "2024-10-07",
            "Source": "N/A"
        },
        {
            "Message ID": 86347,
            "Title": "N/A",
            "Date": "2024-10-07",
            "Source": "https://nvd.nist.gov/vuln/detail/CVE-2024-9018"
        },
        {
            "Message ID": 86346,
            "Title": "N/A",
            "Date": "2024-10-07",
            "Source": "https://nvd.nist.gov/vuln/detail/CVE-2024-8799"
        },
        {
            "Message ID": 86345,
            "Title": "N/A",
            "Date": "2024-10-07",
            "Source": "https://nvd.nist.gov/vuln/detail/CVE-2024-46278"
        },
        {
            "Message ID": 86344,
            "Title": "N/A",
            "Date": "2024-10-07",
            "Source": "https://nvd.nist.gov/vuln/detail/CVE-2024-8505"
        },
        {
            "Message ID": 86343,
            "Title": "N/A",
            "Date": "2024-10-07",
            "Source": "https://nvd.nist.gov/vuln/detail/CVE-2024-45374"
        },
        {
            "Message ID": 86342,
            "Title": "N/A",
            "Date": "2024-10-07",
            "Source": "N/A"
        },
        {
            "Message ID": 86341,
            "Title": "N/A",
            "Date": "2024-10-07",
            "Source": "https://nvd.nist.gov/vuln/detail/CVE-2024-42831"
        },
        {
            "Message ID": 86340,
            "Title": "N/A",
            "Date": "2024-10-07",
            "Source": "https://nvd.nist.gov/vuln/detail/CVE-2024-44674"
        },
        {
            "Message ID": 86339,
            "Title": "N/A",
            "Date": "2024-10-07",
            "Source": "https://nvd.nist.gov/vuln/detail/CVE-2023-38911"
        },
        {
            "Message ID": 86338,
            "Title": "N/A",
            "Date": "2024-10-07",
            "Source": "https://nvd.nist.gov/vuln/detail/CVE-2024-47972"
        },
        {
            "Message ID": 86337,
            "Title": "N/A",
            "Date": "2024-10-07",
            "Source": "https://nvd.nist.gov/vuln/detail/CVE-2024-47971"
        },
        {
            "Message ID": 86336,
            "Title": "N/A",
            "Date": "2024-10-07",
            "Source": "https://nvd.nist.gov/vuln/detail/CVE-2023-35887"
        },
        {
            "Message ID": 86335,
            "Title": "N/A",
            "Date": "2024-10-07",
            "Source": "https://nvd.nist.gov/vuln/detail/CVE-2023-38910"
        },
        {
            "Message ID": 86334,
            "Title": "7,000 WordPress Sites Affected by Unauthenticated Critical Vulnerabilities in LatePoint WordPress Plugin",
            "Date": "2024-10-07",
            "Source": "https://www.wordfence.com/blog/2024/10/7000-wordpress-sites-affected-by-unauthenticated-critical-vulnerabilities-in-latepoint-wordpress-plugin/"
        },
        {
            "Message ID": 86333,
            "Title": "N/A",
            "Date": "2024-10-07",
            "Source": "https://nvd.nist.gov/vuln/detail/CVE-2023-38890"
        },
        {
            "Message ID": 86332,
            "Title": "N/A",
            "Date": "2024-10-07",
            "Source": "https://nvd.nist.gov/vuln/detail/CVE-2023-38839"
        },
        {
            "Message ID": 86331,
            "Title": "N/A",
            "Date": "2024-10-07",
            "Source": "https://nvd.nist.gov/vuln/detail/CVE-2023-32200"
        },
        {
            "Message ID": 86330,
            "Title": "Comcast and Truist Bank customers impacted by debt collectors breach",
            "Date": "2024-10-07",
            "Source": "https://www.malwarebytes.com/blog/news/2024/10/comcast-and-truist-bank-customers-impacted-by-debt-collectors-breach"
        },
        {
            "Message ID": 86329,
            "Title": "N/A",
            "Date": "2024-10-07",
            "Source": "https://nvd.nist.gov/vuln/detail/CVE-2024-7671"
        },
        {
            "Message ID": 86328,
            "Title": "N/A",
            "Date": "2024-10-07",
            "Source": "https://nvd.nist.gov/vuln/detail/CVE-2024-7673"
        },
        {
            "Message ID": 86327,
            "Title": "N/A",
            "Date": "2024-10-07",
            "Source": "https://nvd.nist.gov/vuln/detail/CVE-2024-7674"
        },
        {
            "Message ID": 86326,
            "Title": "N/A",
            "Date": "2024-10-07",
            "Source": "https://nvd.nist.gov/vuln/detail/CVE-2024-7675"
        },
        {
            "Message ID": 86325,
            "Title": "N/A",
            "Date": "2024-10-07",
            "Source": "https://nvd.nist.gov/vuln/detail/CVE-2024-7672"
        },
        {
            "Message ID": 86324,
            "Title": "N/A",
            "Date": "2024-10-07",
            "Source": "https://nvd.nist.gov/vuln/detail/CVE-2024-47556"
        },
        {
            "Message ID": 86323,
            "Title": "N/A",
            "Date": "2024-10-07",
            "Source": "https://nvd.nist.gov/vuln/detail/CVE-2023-6362"
        },
        {
            "Message ID": 86322,
            "Title": "N/A",
            "Date": "2024-10-07",
            "Source": "https://nvd.nist.gov/vuln/detail/CVE-2024-7670"
        },
        {
            "Message ID": 86321,
            "Title": "N/A",
            "Date": "2024-10-07",
            "Source": "https://nvd.nist.gov/vuln/detail/CVE-2023-39666"
        },
        {
            "Message ID": 86320,
            "Title": "N/A",
            "Date": "2024-10-07",
            "Source": "https://nvd.nist.gov/vuln/detail/CVE-2024-27458"
        },
        {
            "Message ID": 86319,
            "Title": "N/A",
            "Date": "2024-10-07",
            "Source": "https://nvd.nist.gov/vuln/detail/CVE-2023-39665"
        },
        {
            "Message ID": 86318,
            "Title": "N/A",
            "Date": "2024-10-07",
            "Source": "https://nvd.nist.gov/vuln/detail/CVE-2024-44068"
        },
        {
            "Message ID": 86317,
            "Title": "N/A",
            "Date": "2024-10-07",
            "Source": "https://nvd.nist.gov/vuln/detail/CVE-2024-30515"
        },
        {
            "Message ID": 86316,
            "Title": "N/A",
            "Date": "2024-10-07",
            "Source": "https://nvd.nist.gov/vuln/detail/CVE-2024-47557"
        },
        {
            "Message ID": 86315,
            "Title": "N/A",
            "Date": "2024-10-07",
            "Source": "https://nvd.nist.gov/vuln/detail/CVE-2024-47558"
        },
        {
            "Message ID": 86314,
            "Title": "N/A",
            "Date": "2024-10-07",
            "Source": "https://nvd.nist.gov/vuln/detail/CVE-2024-45894"
        },
        {
            "Message ID": 86313,
            "Title": "N/A",
            "Date": "2024-10-07",
            "Source": "N/A"
        },
        {
            "Message ID": 86312,
            "Title": "N/A",
            "Date": "2024-10-07",
            "Source": "N/A"
        },
        {
            "Message ID": 86311,
            "Title": "N/A",
            "Date": "2024-10-07",
            "Source": "https://nvd.nist.gov/vuln/detail/CVE-2024-47559"
        },
        {
            "Message ID": 86310,
            "Title": "5 tools IT admins should block right now",
            "Date": "2024-10-07",
            "Source": "https://www.threatdown.com/blog/5-tools-it-admins-should-block-right-now/"
        },
        {
            "Message ID": 86309,
            "Title": "N/A",
            "Date": "2024-10-07",
            "Source": "https://nvd.nist.gov/vuln/detail/CVE-2024-23984"
        },
        {
            "Message ID": 86308,
            "Title": "N/A",
            "Date": "2024-10-07",
            "Source": "https://nvd.nist.gov/vuln/detail/CVE-2023-34395"
        },
        {
            "Message ID": 86307,
            "Title": "Okta Classic customers told to check logs for sign-on bypass",
            "Date": "2024-10-07",
            "Source": "https://www.scworld.com/news/okta-classic-customers-told-to-check-logs-for-sign-on-bypass"
        },
        {
            "Message ID": 86306,
            "Title": "N/A",
            "Date": "2024-10-07",
            "Source": "https://nvd.nist.gov/vuln/detail/CVE-2023-35798"
        },
        {
            "Message ID": 86305,
            "Title": "N/A",
            "Date": "2024-10-07",
            "Source": "https://nvd.nist.gov/vuln/detail/CVE-2024-9289"
        },
        {
            "Message ID": 86304,
            "Title": "N/A",
            "Date": "2024-10-07",
            "Source": "https://nvd.nist.gov/vuln/detail/CVE-2023-22886"
        },
        {
            "Message ID": 86303,
            "Title": "N/A",
            "Date": "2024-10-07",
            "Source": "https://nvd.nist.gov/vuln/detail/CVE-2024-43047"
        },
        {
            "Message ID": 86302,
            "Title": "N/A",
            "Date": "2024-10-07",
            "Source": "https://nvd.nist.gov/vuln/detail/CVE-2023-35797"
        },
        {
            "Message ID": 86301,
            "Title": "N/A",
            "Date": "2024-10-07",
            "Source": "https://nvd.nist.gov/vuln/detail/CVE-2023-39669"
        },
        {
            "Message ID": 86300,
            "Title": "N/A",
            "Date": "2024-10-07",
            "Source": "https://nvd.nist.gov/vuln/detail/CVE-2023-39668"
        },
        {
            "Message ID": 86299,
            "Title": "N/A",
            "Date": "2024-10-07",
            "Source": "https://nvd.nist.gov/vuln/detail/CVE-2024-47555"
        },
        {
            "Message ID": 86298,
            "Title": "N/A",
            "Date": "2024-10-07",
            "Source": "N/A"
        },
        {
            "Message ID": 86297,
            "Title": "N/A",
            "Date": "2024-10-07",
            "Source": "N/A"
        },
        {
            "Message ID": 86296,
            "Title": "N/A",
            "Date": "2024-10-07",
            "Source": "N/A"
        },
        {
            "Message ID": 86295,
            "Title": "N/A",
            "Date": "2024-10-07",
            "Source": "N/A"
        },
        {
            "Message ID": 86294,
            "Title": "N/A",
            "Date": "2024-10-07",
            "Source": "N/A"
        },
        {
            "Message ID": 86293,
            "Title": "N/A",
            "Date": "2024-10-07",
            "Source": "N/A"
        },
        {
            "Message ID": 86292,
            "Title": "N/A",
            "Date": "2024-10-07",
            "Source": "N/A"
        },
        {
            "Message ID": 86291,
            "Title": "N/A",
            "Date": "2024-10-07",
            "Source": "N/A"
        },
        {
            "Message ID": 86290,
            "Title": "N/A",
            "Date": "2024-10-07",
            "Source": "N/A"
        },
        {
            "Message ID": 86289,
            "Title": "N/A",
            "Date": "2024-10-07",
            "Source": "N/A"
        },
        {
            "Message ID": 86288,
            "Title": "Android security advisory  October 2024 Monthly Rollup (AV24-566)",
            "Date": "2024-10-07",
            "Source": "https://cyber.gc.ca/en/alerts-advisories/android-security-advisory-october-2024-monthly-rollup-av24-566"
        },
        {
            "Message ID": 86287,
            "Title": "Red Hat security advisory (AV24-566)",
            "Date": "2024-10-07",
            "Source": "https://cyber.gc.ca/en/alerts-advisories/red-hat-security-advisory-av24-566"
        },
        {
            "Message ID": 86286,
            "Title": "N/A",
            "Date": "2024-10-07",
            "Source": "N/A"
        },
        {
            "Message ID": 86285,
            "Title": "N/A",
            "Date": "2024-10-07",
            "Source": "N/A"
        },
        {
            "Message ID": 86284,
            "Title": "Qualcomm patches high-severity zero-day exploited in attacks",
            "Date": "2024-10-07",
            "Source": "https://www.bleepingcomputer.com/news/security/qualcomm-patches-high-severity-zero-day-exploited-in-attacks/"
        },
        {
            "Message ID": 86283,
            "Title": "N/A",
            "Date": "2024-10-07",
            "Source": "https://nvd.nist.gov/vuln/detail/CVE-2023-39671"
        },
        {
            "Message ID": 86282,
            "Title": "[Control systems] CISA ICS security advisories (AV24-565)",
            "Date": "2024-10-07",
            "Source": "https://cyber.gc.ca/en/alerts-advisories/control-systems-cisa-ics-security-advisories-av24-565"
        },
        {
            "Message ID": 86281,
            "Title": "N/A",
            "Date": "2024-10-07",
